{
  "$id": "https://gcn.nasa.gov/schema/gcn/notices/swift/bat/guano/alert.schema.json",
  "$schema": "https://json-schema.org/draft/2020-12/schema",
  "type": "object",
  "properties": {
    "reporter": {
      "$ref": "/schema/gcn/notices/core/Reporter.schema.json"
    },
    "alert": {
      "$ref": "/schema/gcn/notices/core/Alert.schema.json"
    },
    "event": {
      "$ref": "/schema/gcn/notices/core/Event.schema.json"
    },
    "datetime": {
      "$ref": "/schema/gcn/notices/core/DateTime.schema.json"
    },
    "localization": {
      "$ref": "/schema/gcn/notices/core/Localization.schema.json"
    },
    "statistics": {
      "$ref": "/schema/gcn/notices/core/Statistics.schema.json"
    }
  },
  "required": ["reporter", "alert", "event", "datetime"]
}
