{
  "$schema": "https://gcn.nasa.gov/schema/gcn/notices/swift/bat/guano/alert.schema.json",
  "reporter": {
    "mission": "Swift",
    "instrument": "BAT-GUANO",
    "record_number": 4
  },
  "alert": {
    "alert_datetime": "[UTC, ISO 8601]",
    "alert_tense": "current",
    "alert_type": "retraction"
  },
  "datetime": {
    "trigger_time": "Time of the trigger [ISO 8601]"
  },
  "event": {
    "data_archive_page": "https://swift.gsfc.nasa.gov/archive/",
    "Id": "[700000031, 7000000000]"
  }
}
